{"$defs":{"exact_heads":{"additionalProperties":false,"properties":{"context":{"$ref":"#/$defs/head"},"control":{"$ref":"#/$defs/head"},"product":{"$ref":"#/$defs/head"}},"required":["control","context","product"],"type":"object"},"exclusion":{"additionalProperties":false,"properties":{"path":{"minLength":1,"type":"string"},"repository":{"enum":["Dsamofalov/hwm-control","Dsamofalov/hwm-context"]},"role":{"enum":["historical_snapshot_only_not_current_authority","excluded_first_batch_selector"]},"source_commit":{"pattern":"^[0-9a-f]{40}$","type":"string"}},"required":["repository","source_commit","path","role"],"type":"object"},"head":{"additionalProperties":false,"properties":{"commit":{"pattern":"^[0-9a-f]{40}$","type":"string"},"repository":{"pattern":"^[A-Za-z0-9_.-]+/[A-Za-z0-9_.-]+$","type":"string"}},"required":["repository","commit"],"type":"object"},"source":{"additionalProperties":false,"properties":{"content_sha256":{"pattern":"^[0-9a-f]{64}$","type":"string"},"git_blob_sha":{"pattern":"^[0-9a-f]{40}$","type":"string"},"knowledge_delta_task_key":{"oneOf":[{"type":"null"},{"pattern":"^I[0-9]{2}-[0-9]{4}$","type":"string"}]},"media_type":{"enum":["application/json","text/plain"]},"ordering_key":{"pattern":"^[0-9]{4}:[a-z0-9-]+:[A-Za-z0-9-]+$","type":"string"},"path":{"maxLength":500,"minLength":1,"pattern":"^(?!/)(?!.*(?:^|/)\\.\\.(?:/|$))(?!.*//).+[^/]$","type":"string"},"public_data_classification":{"const":"public-disclosure-safe"},"repository":{"enum":["Dsamofalov/hwm-control","Dsamofalov/hwm-context"]},"source_commit":{"pattern":"^[0-9a-f]{40}$","type":"string"},"source_id":{"pattern":"^src1-[0-9a-f]{64}$","type":"string"},"source_type":{"enum":["knowledge_delta","repository_file"]},"utf8_bytes":{"maximum":65536,"minimum":0,"type":"integer"}},"required":["ordering_key","source_id","source_type","repository","source_commit","path","git_blob_sha","content_sha256","utf8_bytes","media_type","knowledge_delta_task_key","public_data_classification"],"type":"object"}},"$id":"urn:hwm:schema:semantic-batch-input-config:v1","$schema":"https://json-schema.org/draft/2020-12/schema","additionalProperties":false,"properties":{"authority_boundary":{"additionalProperties":false,"properties":{"state_current":{"$ref":"#/$defs/exclusion"},"task_context_i09_0048":{"$ref":"#/$defs/exclusion"}},"required":["state_current","task_context_i09_0048"],"type":"object"},"config_id":{"pattern":"^sbic1-[0-9a-f]{64}$","type":"string"},"config_sha256":{"pattern":"^[0-9a-f]{64}$","type":"string"},"historical_semantics":{"additionalProperties":false,"properties":{"conflicts":{"maxItems":0,"type":"array"},"silent_winner_selection":{"const":false},"supersessions":{"maxItems":0,"type":"array"}},"required":["conflicts","supersessions","silent_winner_selection"],"type":"object"},"partition_policy":{"additionalProperties":false,"properties":{"max_partition_utf8_bytes":{"const":65536},"oversized_single_source":{"const":"fail-closed:P5R1_PARTITION_SOURCE_OVERSIZE"},"unit":{"const":"utf-8-bytes"}},"required":["max_partition_utf8_bytes","unit","oversized_single_source"],"type":"object"},"runtime_manifest_binding":{"additionalProperties":false,"properties":{"branch_names_forbidden":{"const":true},"generator":{"const":"control.semantic_batch_manifest.generate_manifest"},"manifest_materialized_later_in_issue":{"const":67},"manifest_schema":{"const":"hwm-semantic-batch-manifest/v1"},"runtime_exact_heads_required":{"const":["control","context","product"]},"source_snapshot_immutable":{"const":true}},"required":["manifest_schema","generator","runtime_exact_heads_required","branch_names_forbidden","source_snapshot_immutable","manifest_materialized_later_in_issue"],"type":"object"},"schema":{"const":"hwm-semantic-batch-input-config/v1"},"source_snapshot":{"additionalProperties":false,"properties":{"canonical_source_frontier_sha256":{"pattern":"^[0-9a-f]{64}$","type":"string"},"exact_source_heads":{"$ref":"#/$defs/exact_heads"},"freeze_boundary_task_key":{"const":"I09-0066"},"new_material_after_freeze":{"const":"later_batch"},"source_count":{"const":19},"sources":{"items":{"$ref":"#/$defs/source"},"maxItems":19,"minItems":19,"type":"array"},"total_utf8_bytes":{"const":176188}},"required":["freeze_boundary_task_key","new_material_after_freeze","exact_source_heads","source_count","total_utf8_bytes","canonical_source_frontier_sha256","sources"],"type":"object"},"target":{"additionalProperties":false,"properties":{"issue_number":{"const":67},"repository":{"const":"Dsamofalov/hwm-control"}},"required":["repository","issue_number"],"type":"object"},"trigger":{"additionalProperties":false,"properties":{"canonical_frontier_sha256":{"pattern":"^[0-9a-f]{64}$","type":"string"},"evidence_sha256":{"pattern":"^[0-9a-f]{64}$","type":"string"},"exact_source_readback_heads":{"$ref":"#/$defs/exact_heads"},"manifest_projection":{"additionalProperties":false,"properties":{"affected_count":{"const":17},"kind":{"const":"knowledge_health_signal"},"signal_id":{"pattern":"^knowledge-health\\.coverage:[0-9a-f]{64}$","type":"string"},"status":{"const":"coverage_gap"}},"required":["kind","signal_id","status","affected_count"],"type":"object"},"ordered_uncovered_knowledge_delta_frontier":{"items":{"additionalProperties":false,"properties":{"source_id":{"pattern":"^src1-[0-9a-f]{64}$","type":"string"},"task_key":{"pattern":"^I[0-9]{2}-[0-9]{4}$","type":"string"}},"required":["task_key","source_id"],"type":"object"},"maxItems":17,"minItems":17,"type":"array"},"policy_kind":{"const":"knowledge_health/coverage"},"previous_accepted_semantic_coverage":{"additionalProperties":false,"properties":{"accepted_batch_ids":{"maxItems":0,"type":"array"},"accepted_coverage_artifacts":{"maxItems":0,"type":"array"},"accepted_semantic_batch_count":{"const":0},"accepted_semantic_coverage_count":{"const":0},"method":{"const":"exact_protected_tree_inventory"}},"required":["method","accepted_semantic_batch_count","accepted_semantic_coverage_count","accepted_batch_ids","accepted_coverage_artifacts"],"type":"object"},"uncovered_knowledge_delta_count":{"const":17},"uncovered_knowledge_delta_utf8_bytes":{"const":174209}},"required":["policy_kind","previous_accepted_semantic_coverage","ordered_uncovered_knowledge_delta_frontier","uncovered_knowledge_delta_count","uncovered_knowledge_delta_utf8_bytes","canonical_frontier_sha256","exact_source_readback_heads","evidence_sha256","manifest_projection"],"type":"object"},"validation_policy":{"additionalProperties":false,"properties":{"blob_sha_required":{"const":true},"content_sha256_required":{"const":true},"deterministic_replay_required":{"const":true},"duplicate_source_ids_forbidden":{"const":true},"exact_source_readback_required":{"const":true},"public_data_default_deny":{"const":true},"source_existence_required":{"const":true},"strict_ordering_required":{"const":true},"trigger_evidence_required":{"const":true},"utf8_byte_size_required":{"const":true}},"required":["exact_source_readback_required","source_existence_required","blob_sha_required","content_sha256_required","utf8_byte_size_required","strict_ordering_required","duplicate_source_ids_forbidden","public_data_default_deny","trigger_evidence_required","deterministic_replay_required"],"type":"object"}},"required":["schema","config_id","config_sha256","target","source_snapshot","trigger","partition_policy","historical_semantics","authority_boundary","runtime_manifest_binding","validation_policy"],"title":"HWM deterministic semantic batch input config v1","type":"object"}