{"authority_boundary":{"state_current":{"path":"state/current.json","repository":"Dsamofalov/hwm-control","role":"historical_snapshot_only_not_current_authority","source_commit":"d9c0745741315cfd5f3d322e77949d1040dabb9a"},"task_context_i09_0048":{"path":"tasks/I09-0048/context.json","repository":"Dsamofalov/hwm-context","role":"excluded_first_batch_selector","source_commit":"d651f40d0bb3a3ef0e52fca95e5400ed3db3d772"}},"config_id":"sbic1-e3ef5c9f6753c8413cdac51b244ac7c4916302c82d75af722658dff7cdbc52d9","config_sha256":"e3ef5c9f6753c8413cdac51b244ac7c4916302c82d75af722658dff7cdbc52d9","historical_semantics":{"conflicts":[],"silent_winner_selection":false,"supersessions":[]},"partition_policy":{"max_partition_utf8_bytes":65536,"oversized_single_source":"fail-closed:P5R1_PARTITION_SOURCE_OVERSIZE","unit":"utf-8-bytes"},"runtime_manifest_binding":{"branch_names_forbidden":true,"generator":"control.semantic_batch_manifest.generate_manifest","manifest_materialized_later_in_issue":67,"manifest_schema":"hwm-semantic-batch-manifest/v1","runtime_exact_heads_required":["control","context","product"],"source_snapshot_immutable":true},"schema":"hwm-semantic-batch-input-config/v1","source_snapshot":{"canonical_source_frontier_sha256":"0313558479287a3afa6025bd2dbc5ee65ac149eae184b7ab03f4e6f970245f57","exact_source_heads":{"context":{"commit":"d651f40d0bb3a3ef0e52fca95e5400ed3db3d772","repository":"Dsamofalov/hwm-context"},"control":{"commit":"d9c0745741315cfd5f3d322e77949d1040dabb9a","repository":"Dsamofalov/hwm-control"},"product":{"commit":"8fd669336b36064e842252d69fb4016cc526a9d4","repository":"Dsamofalov/hwm_predictor"}},"freeze_boundary_task_key":"I09-0066","new_material_after_freeze":"later_batch","source_count":19,"sources":[{"content_sha256":"9e40082088f6d6285ea2fccceb270321fdacf53bce6f2cbad4b16033cb60a82a","git_blob_sha":"60dbb41d8c872501a3f086715186686b8514a274","knowledge_delta_task_key":"I06-0009","media_type":"application/json","ordering_key":"0001:knowledge-delta:I06-0009","path":"knowledge-deltas/I06-0009.json","public_data_classification":"public-disclosure-safe","repository":"Dsamofalov/hwm-control","source_commit":"d9c0745741315cfd5f3d322e77949d1040dabb9a","source_id":"src1-1513eacf3522c7cd8996d9829ce5f9609e701aa96aac19aa9d9f8753be293e2d","source_type":"knowledge_delta","utf8_bytes":6150},{"content_sha256":"1b3204b1572bba4211efa407e6432f05e3fef490404aa6aec9e2e568c98d3c47","git_blob_sha":"ef5fef746f6aebef04d5b12ffc758250557f06cf","knowledge_delta_task_key":"I07-0010","media_type":"application/json","ordering_key":"0002:knowledge-delta:I07-0010","path":"knowledge-deltas/I07-0010.json","public_data_classification":"public-disclosure-safe","repository":"Dsamofalov/hwm-control","source_commit":"d9c0745741315cfd5f3d322e77949d1040dabb9a","source_id":"src1-9de7fe1c8ec5736b785ae6e92a790f9dd4821b52bdc3b600fc7b8b9d9944fb29","source_type":"knowledge_delta","utf8_bytes":5817},{"content_sha256":"6ad058f1d6e636ded907cf3531f113b2b9f2614b5b6311776dd842e1507d711f","git_blob_sha":"ed6ce29bc3356282ab6a8d2f0059c2bafea7e758","knowledge_delta_task_key":"I08-0035","media_type":"application/json","ordering_key":"0003:knowledge-delta:I08-0035","path":"knowledge-deltas/I08-0035.json","public_data_classification":"public-disclosure-safe","repository":"Dsamofalov/hwm-control","source_commit":"d9c0745741315cfd5f3d322e77949d1040dabb9a","source_id":"src1-c9759ec0d8276aae1e7886861650f7c81f1d597eb3b7fa888483de4fa3e7647a","source_type":"knowledge_delta","utf8_bytes":3944},{"content_sha256":"61a9728097ac97bf332d9384192882862f70192ee5c94cac5226c400eaebf74d","git_blob_sha":"bbb48a2d6da8a174e64ea1090407a34e232bd325","knowledge_delta_task_key":"I08-0037","media_type":"application/json","ordering_key":"0004:knowledge-delta:I08-0037","path":"knowledge-deltas/I08-0037.json","public_data_classification":"public-disclosure-safe","repository":"Dsamofalov/hwm-control","source_commit":"d9c0745741315cfd5f3d322e77949d1040dabb9a","source_id":"src1-df1dea1806ee611269d150e5d1886b6bdc1c6676f9002f411e9d29e492d2d898","source_type":"knowledge_delta","utf8_bytes":10828},{"content_sha256":"11cd1732204c4ffe7c23fa27cca61e41d5d9db61f889460055d0d619f926ff3d","git_blob_sha":"211e7ce9581746813b40b5b43a135b6b570da28c","knowledge_delta_task_key":"I08-0038","media_type":"application/json","ordering_key":"0005:knowledge-delta:I08-0038","path":"knowledge-deltas/I08-0038.json","public_data_classification":"public-disclosure-safe","repository":"Dsamofalov/hwm-control","source_commit":"d9c0745741315cfd5f3d322e77949d1040dabb9a","source_id":"src1-644ca4ebf6c53d046548e1b7b4fe3153c3bd7b945d0049aafa0b173e83a058ca","source_type":"knowledge_delta","utf8_bytes":10241},{"content_sha256":"88389ad19a066e2aeccbeb1f5a56d17916cf78acfa6c9b429efefd58a3fcc645","git_blob_sha":"fdb9aada1ae63e1bb3d730c03b64674bf78ada98","knowledge_delta_task_key":"I08-0040","media_type":"application/json","ordering_key":"0006:knowledge-delta:I08-0040","path":"knowledge-deltas/I08-0040.json","public_data_classification":"public-disclosure-safe","repository":"Dsamofalov/hwm-control","source_commit":"d9c0745741315cfd5f3d322e77949d1040dabb9a","source_id":"src1-45110d2c80ba12c187ccf31b87c8b5c2702983060019fc0a85156abf39581e3e","source_type":"knowledge_delta","utf8_bytes":12043},{"content_sha256":"09be63575c5077ed321ec4855923efa3df939a61a1641e534f25193dae7943e6","git_blob_sha":"59cd750bd334c4b5929258e82ac962ccee98e5df","knowledge_delta_task_key":"I08-0042","media_type":"application/json","ordering_key":"0007:knowledge-delta:I08-0042","path":"knowledge-deltas/I08-0042.json","public_data_classification":"public-disclosure-safe","repository":"Dsamofalov/hwm-control","source_commit":"d9c0745741315cfd5f3d322e77949d1040dabb9a","source_id":"src1-0fa22155b102f83697b835c2b399bcefb3fd163b5332d255f9f33e592432d53c","source_type":"knowledge_delta","utf8_bytes":15007},{"content_sha256":"13fce56773189928bc3270e703b68d0879677bc85e4a33b021c10f8927fa0ebe","git_blob_sha":"159f6fae4fd3cf07178071a08270219cc2966745","knowledge_delta_task_key":"I09-0045","media_type":"application/json","ordering_key":"0008:knowledge-delta:I09-0045","path":"knowledge-deltas/I09-0045.json","public_data_classification":"public-disclosure-safe","repository":"Dsamofalov/hwm-control","source_commit":"d9c0745741315cfd5f3d322e77949d1040dabb9a","source_id":"src1-8859b0ea2062e3a883b009ed120dc9415a902590d35f93dfe102459a8cfa4749","source_type":"knowledge_delta","utf8_bytes":5920},{"content_sha256":"059756b2fdfc64291f5883d950dd4ef425e08a693898ae8a7430ca5cc2afbf03","git_blob_sha":"6cd67ad346476627d679dab574743ac7e28a6eff","knowledge_delta_task_key":"I09-0046","media_type":"application/json","ordering_key":"0009:knowledge-delta:I09-0046","path":"knowledge-deltas/I09-0046.json","public_data_classification":"public-disclosure-safe","repository":"Dsamofalov/hwm-control","source_commit":"d9c0745741315cfd5f3d322e77949d1040dabb9a","source_id":"src1-966412956ab7370cb2656b0197bda6526c0dfe0ccd0b63949cb6fe993f9ee7c4","source_type":"knowledge_delta","utf8_bytes":6435},{"content_sha256":"cfed2afdf5544efa398e2c102bd75024f81fa83a463d6a3ebe48968ac45e6b56","git_blob_sha":"f121a1c94073a967507888f26f2aee3f3973bba0","knowledge_delta_task_key":"I09-0047","media_type":"application/json","ordering_key":"0010:knowledge-delta:I09-0047","path":"knowledge-deltas/I09-0047.json","public_data_classification":"public-disclosure-safe","repository":"Dsamofalov/hwm-control","source_commit":"d9c0745741315cfd5f3d322e77949d1040dabb9a","source_id":"src1-b7458b3c6cb63f58649d2fec4dce2d4e9dc16f1b26a7a8f3be8f76d4dff8f65e","source_type":"knowledge_delta","utf8_bytes":14008},{"content_sha256":"90e4881cd407485b3e708a023a4c653397401a0b5f1c2af35aebc362e4bf23cd","git_blob_sha":"5699f6f1d1fb09f8c3956d6e38660a1bdf5df3d5","knowledge_delta_task_key":"I09-0048","media_type":"application/json","ordering_key":"0011:knowledge-delta:I09-0048","path":"knowledge-deltas/I09-0048.json","public_data_classification":"public-disclosure-safe","repository":"Dsamofalov/hwm-control","source_commit":"d9c0745741315cfd5f3d322e77949d1040dabb9a","source_id":"src1-a5ab013bdcaa707a6b8c65f20ab84b92c128f25f774bf1cc8f09c6cde918148a","source_type":"knowledge_delta","utf8_bytes":15977},{"content_sha256":"79e0a6a746736e5eb34bf93b4e8c87706889816c161226d24d1a59d91be680fc","git_blob_sha":"366f69aefd96cd09c3a020fecf256f3842fcb794","knowledge_delta_task_key":"I09-0049","media_type":"application/json","ordering_key":"0012:knowledge-delta:I09-0049","path":"knowledge-deltas/I09-0049.json","public_data_classification":"public-disclosure-safe","repository":"Dsamofalov/hwm-control","source_commit":"d9c0745741315cfd5f3d322e77949d1040dabb9a","source_id":"src1-dd5dc484443578d3b98dccc592c7a31f5094533bd9d1531f3e71e4d34f5f11b2","source_type":"knowledge_delta","utf8_bytes":7828},{"content_sha256":"e62a1a3637f33c58189d9d08d6c6ddc4237e5f9bf3bcea3a40a5a151d4a5229c","git_blob_sha":"246e548d060a7d0289a2f11d4be23c9bed7839c6","knowledge_delta_task_key":"I09-0054","media_type":"application/json","ordering_key":"0013:knowledge-delta:I09-0054","path":"knowledge-deltas/I09-0054.json","public_data_classification":"public-disclosure-safe","repository":"Dsamofalov/hwm-control","source_commit":"d9c0745741315cfd5f3d322e77949d1040dabb9a","source_id":"src1-1a68af9dbabc92a452371c37a47407f469c8915ceb0698ea76b8ec02a82f5b9b","source_type":"knowledge_delta","utf8_bytes":6303},{"content_sha256":"1bbbb9e750c79bb76e584e322ac82492494f4947020bff9d016e0990cfcb34f9","git_blob_sha":"4ee7803266b3a661339832c2f46296a0e49bd042","knowledge_delta_task_key":"I09-0056","media_type":"application/json","ordering_key":"0014:knowledge-delta:I09-0056","path":"knowledge-deltas/I09-0056.json","public_data_classification":"public-disclosure-safe","repository":"Dsamofalov/hwm-control","source_commit":"d9c0745741315cfd5f3d322e77949d1040dabb9a","source_id":"src1-edfdd512648f3ff3742f066cff9f0a15d4cb59aeab191a09b61c0042c51cdb5e","source_type":"knowledge_delta","utf8_bytes":22048},{"content_sha256":"09498878381c0073b0e07523